Menu,               Title                                         ,URL                                            ,Description
Github,    C# implementation of the GCC-PHAT algorithm ,https://github.com/pmarmaroli/gccphat          ,a command-line tool for estimating the time delay between the two channels of a stereo signal using the Generalized Cross-Correlation Phase Transform (GCC-PHAT) technique
Github,    Matlab animations                             ,https://github.com/pmarmaroli/matlab-animation ,Some Matlab animations of key physics and signal processing concepts
Github,    AES file encryption and decryption            ,https://github.com/pmarmaroli/CryptoWizard     ,a versatile command-line tool for AES file encryption decryption and key generation
Contact,    My Linkedin profile     ,   https://www.linkedin.com/in/pmarmaroli/, Let's connect...
Projects,   Vocametrix, https://www.vocametrix.com, Voice-controlled games and audio analysis tools for speech therapy
Demo Video, 3D Sound with Matlab, https://studio.youtube.com/video/S-NQ4vEIL_w, Implementation of an HRTF-based interface for 3D sound rendering